{
  "$schema": "https://json-schema.org/draft/2020-12/schema",
  "$id": "https://schemas.impresari-context.invalid/v1/macos-local-vm-ephemeral-product-candidate-receipt.schema.json",
  "title": "ADR-0110 macOS ephemeral product candidate receipt",
  "type": "object",
  "additionalProperties": false,
  "required": [
    "schema_name",
    "schema_version",
    "profile_id",
    "profile_digest",
    "record_id",
    "record_digest",
    "candidate_source_revision",
    "candidate_source_archive_sha256",
    "product_version",
    "target",
    "status",
    "independent_builds",
    "product_artifacts_per_build",
    "byte_identical_artifacts",
    "canonical_product_identity",
    "dependency_evidence_complete",
    "all_build_roots_deleted",
    "runnable_artifacts_retained",
    "product_candidates_executed",
    "guest_candidate_complete",
    "release_candidate_complete",
    "release_bundle_assembled",
    "developer_id_signature_verified",
    "apple_notarization_verified",
    "bundle_installed",
    "cask_created",
    "vm_launch",
    "analyzer_execution",
    "production_admitted",
    "macos_iar_1b_admitted",
    "authority_added"
  ],
  "properties": {
    "schema_name": {"const": "macos-local-vm-ephemeral-product-candidate-receipt"},
    "schema_version": {"const": "1.0.0"},
    "profile_id": {"const": "iar-macos-local-vm-ephemeral-product-candidate-v1"},
    "profile_digest": {"const": "sha256:df0536a8d19eacfc3175074b4a557643526a80353e3e31927a51effd9aea02c5"},
    "record_id": {"const": "iar-macos-local-vm-ephemeral-product-candidate-2026-09-01.1"},
    "record_digest": {"const": "sha256:4b850177a1ab70eb2cb0330fa3c18ccae4fb00d29e7ba4f4c3b6b772c3ebea69"},
    "candidate_source_revision": {"const": "aca656771f9286b13fbcc046b133ade62b58da2a"},
    "candidate_source_archive_sha256": {"const": "sha256:f26fcf7ccdc6cb499e3eacc1f479a93083c58d397c8730b72a56d43d8c0adb8b"},
    "product_version": {"const": "0.2.0"},
    "target": {"const": "aarch64-apple-darwin"},
    "status": {"const": "product_candidates_built_and_deleted"},
    "independent_builds": {"const": "2"},
    "product_artifacts_per_build": {"const": "4"},
    "byte_identical_artifacts": {"const": "4"},
    "canonical_product_identity": {"const": "sha256:7bd280339e2a8cf30c26fc2ad96225f52cad5593c63ea621e7e44ba62b9bd5ca"},
    "dependency_evidence_complete": {"const": true},
    "all_build_roots_deleted": {"const": true},
    "runnable_artifacts_retained": {"const": false},
    "product_candidates_executed": {"const": false},
    "guest_candidate_complete": {"const": false},
    "release_candidate_complete": {"const": false},
    "release_bundle_assembled": {"const": false},
    "developer_id_signature_verified": {"const": false},
    "apple_notarization_verified": {"const": false},
    "bundle_installed": {"const": false},
    "cask_created": {"const": false},
    "vm_launch": {"const": false},
    "analyzer_execution": {"const": false},
    "production_admitted": {"const": false},
    "macos_iar_1b_admitted": {"const": false},
    "authority_added": {"const": false}
  }
}
