{
  "schema_name": "macos-local-vm-ephemeral-product-candidate-receipt",
  "schema_version": "1.0.0",
  "profile_id": "iar-macos-local-vm-ephemeral-product-candidate-v1",
  "profile_digest": "sha256:df0536a8d19eacfc3175074b4a557643526a80353e3e31927a51effd9aea02c5",
  "record_id": "iar-macos-local-vm-ephemeral-product-candidate-2026-09-01.1",
  "record_digest": "sha256:4b850177a1ab70eb2cb0330fa3c18ccae4fb00d29e7ba4f4c3b6b772c3ebea69",
  "candidate_source_revision": "aca656771f9286b13fbcc046b133ade62b58da2a",
  "candidate_source_archive_sha256": "sha256:f26fcf7ccdc6cb499e3eacc1f479a93083c58d397c8730b72a56d43d8c0adb8b",
  "product_version": "0.2.0",
  "target": "aarch64-apple-darwin",
  "status": "product_candidates_built_and_deleted",
  "independent_builds": "2",
  "product_artifacts_per_build": "4",
  "byte_identical_artifacts": "4",
  "canonical_product_identity": "sha256:7bd280339e2a8cf30c26fc2ad96225f52cad5593c63ea621e7e44ba62b9bd5ca",
  "dependency_evidence_complete": true,
  "all_build_roots_deleted": true,
  "runnable_artifacts_retained": false,
  "product_candidates_executed": false,
  "guest_candidate_complete": false,
  "release_candidate_complete": false,
  "release_bundle_assembled": false,
  "developer_id_signature_verified": false,
  "apple_notarization_verified": false,
  "bundle_installed": false,
  "cask_created": false,
  "vm_launch": false,
  "analyzer_execution": false,
  "production_admitted": false,
  "macos_iar_1b_admitted": false,
  "authority_added": false
}
